{
  "$schema": "http://json-schema.org/draft-07/schema#",
  "$id": "https://fleekdash.com/schemas/fleekdash-manifest.schema.json",
  "title": "FleekDash extension manifest (fleekdash.json)",
  "description": "Mirrors FleekDash\\Extension\\ExtensionManifest::validate(). Place a fleekdash.json in a plugin, mu-plugin, fleeklet or theme directory to be discovered by the Hub.",
  "type": "object",
  "required": ["kind", "id", "name"],
  "additionalProperties": false,
  "properties": {
    "$schema": {
      "type": "string",
      "description": "Editor self-description pointer; ignored by the runtime validator."
    },
    "kind": {
      "type": "string",
      "enum": ["compat", "integration", "app", "snippet", "connector"]
    },
    "id": {
      "type": "string",
      "pattern": "^[a-z0-9][a-z0-9\\-]*$",
      "description": "Lowercase slug; the stable identity across Hub, merger and storage."
    },
    "name": { "type": "string", "minLength": 1 },
    "description": { "type": "string" },
    "version": {
      "type": "string",
      "pattern": "^\\d+\\.\\d+\\.\\d+(-[a-zA-Z0-9\\-]+)?$"
    },
    "author": { "type": "string" },
    "author_uri": { "type": "string", "format": "uri" },
    "icon": {
      "oneOf": [
        {
          "type": "string",
          "enum": [
            "sparkles",
            "message-square",
            "settings",
            "dashboard",
            "users",
            "file",
            "folder",
            "mail",
            "bell",
            "heart",
            "star",
            "search",
            "plus",
            "edit",
            "trash",
            "check",
            "x",
            "menu",
            "more-vertical",
            "briefcase",
            "shopping-cart",
            "credit-card",
            "dollar-sign",
            "trending-up",
            "trending-down",
            "activity",
            "bar-chart",
            "phone",
            "video",
            "mic",
            "send",
            "inbox",
            "archive",
            "tool",
            "wrench",
            "code",
            "terminal",
            "database",
            "server",
            "cloud",
            "download",
            "upload",
            "link",
            "external-link",
            "box",
            "package",
            "layers"
          ]
        },
        { "type": "string", "pattern": "^https?://.+" }
      ]
    },
    "category": { "type": "string", "default": "plugin" },
    "priority": { "type": "integer", "default": 100 },
    "plugin_file": {
      "type": "string",
      "pattern": "^[a-zA-Z0-9\\-_\\/]+\\.php$",
      "description": "Main plugin file relative to the extension dir. Required for kind compat/integration."
    },
    "theme": { "type": "string" },
    "settings_page_url": {
      "type": "string",
      "pattern": "^[a-z0-9_-]+\\.php(\\?[a-zA-Z0-9_\\-=&%.\\/]*)?$"
    },
    "requires": {
      "type": "object",
      "additionalProperties": false,
      "properties": {
        "wp": {
          "type": "string",
          "pattern": "^\\d+(\\.\\d+){0,2}([-+][a-zA-Z0-9.\\-]*)?$"
        },
        "fleekdash": {
          "type": "string",
          "pattern": "^\\d+(\\.\\d+){0,2}([-+][a-zA-Z0-9.\\-]*)?$"
        },
        "php": {
          "type": "string",
          "pattern": "^\\d+(\\.\\d+){0,2}([-+][a-zA-Z0-9.\\-]*)?$"
        },
        "plugins": {
          "type": "array",
          "items": { "type": "string" }
        },
        "themes": {
          "type": "array",
          "items": { "type": "string" }
        }
      }
    },
    "entry": {
      "type": "string",
      "pattern": "^(?!/)(?!.*\\.\\.)[a-zA-Z0-9_\\-\\.\\/]+\\.php$",
      "description": "Snippet entry point: relative .php path, no traversal."
    },
    "settings": { "$ref": "#/definitions/settingsSchema" },
    "sections": {
      "type": "object",
      "description": "Map of target FleekDash settings-section slug → field schema.",
      "additionalProperties": { "$ref": "#/definitions/settingsSchema" }
    },
    "feature_key": { "type": "string" },
    "license_required": { "type": "boolean" },
    "required_tier": { "type": "string" },
    "allowed_roles": {
      "type": "array",
      "items": { "type": "string" }
    },
    "tags": {
      "type": "array",
      "items": { "type": "string" }
    },
    "preview_link": { "type": "string" },
    "roadmap_link": { "type": "string", "format": "uri" },
    "mode": {
      "type": "string",
      "description": "e.g. \"upcoming\" for non-installable catalog cards."
    },
    "connector_id": {
      "type": "string",
      "description": "kind: integration → WP 7.0 native connector id; resolved to connector_status in the Hub."
    }
  },
  "definitions": {
    "settingsSchema": {
      "type": "object",
      "additionalProperties": {
        "type": "object",
        "properties": {
          "type": { "type": "string", "default": "string" },
          "label": { "type": "string" },
          "description": { "type": "string" },
          "required": { "type": "boolean" },
          "encrypted": { "type": "boolean" },
          "option_key": { "type": "string" },
          "options": {
            "type": "object",
            "additionalProperties": { "type": "string" }
          },
          "min": { "type": ["number", "string"] },
          "max": { "type": ["number", "string"] },
          "step": { "type": ["number", "string"] },
          "default": {}
        },
        "additionalProperties": false
      }
    }
  },
  "allOf": [
    {
      "if": { "properties": { "kind": { "enum": ["compat", "integration"] } } },
      "then": { "required": ["plugin_file"] }
    }
  ]
}
